<?xml version="1.0"?>
<?xml-stylesheet type="text/xsl" href="pdml2html.xsl"?>
<!-- You can find pdml2html.xsl in /usr/share/wireshark or at http://anonsvn.wireshark.org/trunk/wireshark/pdml2html.xsl. -->
<pdml version="0" creator="wireshark/1.10.2" time="Fri Jan  3 21:29:14 2014" capture_file="/tmp/wireshark_pcapng_eth0_20140103212605_0C02FO">
<packet>
  <proto name="geninfo" pos="0" showname="General information" size="74">
    <field name="num" pos="0" show="1924" showname="Number" value="784" size="74"/>
    <field name="len" pos="0" show="74" showname="Frame Length" value="4a" size="74"/>
    <field name="caplen" pos="0" show="74" showname="Captured Length" value="4a" size="74"/>
    <field name="timestamp" pos="0" show="Jan  3, 2014 21:27:11.894774000 NST" showname="Captured Time" value="1388797031.894774000" size="74"/>
  </proto>
  <proto name="frame" showname="Frame 1924: 74 bytes on wire (592 bits), 74 bytes captured (592 bits) on interface 0" size="74" pos="0">
    <field name="frame.interface_id" showname="Interface id: 0" size="0" pos="0" show="0"/>
    <field name="frame.encap_type" showname="Encapsulation type: Ethernet (1)" size="0" pos="0" show="1"/>
    <field name="frame.time" showname="Arrival Time: Jan  3, 2014 21:27:11.894774000 NST" size="0" pos="0" show="Jan  3, 2014 21:27:11.894774000"/>
    <field name="frame.offset_shift" showname="Time shift for this packet: 0.000000000 seconds" size="0" pos="0" show="0.000000000"/>
    <field name="frame.time_epoch" showname="Epoch Time: 1388797031.894774000 seconds" size="0" pos="0" show="1388797031.894774000"/>
    <field name="frame.time_delta" showname="Time delta from previous captured frame: 0.000156000 seconds" size="0" pos="0" show="0.000156000"/>
    <field name="frame.time_delta_displayed" showname="Time delta from previous displayed frame: 0.000000000 seconds" size="0" pos="0" show="0.000000000"/>
    <field name="frame.time_relative" showname="Time since reference or first frame: 66.485455000 seconds" size="0" pos="0" show="66.485455000"/>
    <field name="frame.number" showname="Frame Number: 1924" size="0" pos="0" show="1924"/>
    <field name="frame.len" showname="Frame Length: 74 bytes (592 bits)" size="0" pos="0" show="74"/>
    <field name="frame.cap_len" showname="Capture Length: 74 bytes (592 bits)" size="0" pos="0" show="74"/>
    <field name="frame.marked" showname="Frame is marked: True" size="0" pos="0" show="1"/>
    <field name="frame.ignored" showname="Frame is ignored: False" size="0" pos="0" show="0"/>
    <field name="frame.protocols" showname="Protocols in frame: eth:ip:tcp" size="0" pos="0" show="eth:ip:tcp"/>
    <field name="frame.coloring_rule.name" showname="Coloring Rule Name: TCP SYN/FIN" size="0" pos="0" show="TCP SYN/FIN"/>
    <field name="frame.coloring_rule.string" showname="Coloring Rule String: tcp.flags &amp; 0x02 || tcp.flags.fin == 1" size="0" pos="0" show="tcp.flags &amp; 0x02 || tcp.flags.fin == 1"/>
  </proto>
  <proto name="eth" showname="Ethernet II, Src: Pegatron_2f:4d:48 (4c:72:b9:2f:4d:48), Dst: AsustekC_f6:97:3e (e0:cb:4e:f6:97:3e)" size="14" pos="0">
    <field name="eth.dst" showname="Destination: AsustekC_f6:97:3e (e0:cb:4e:f6:97:3e)" size="6" pos="0" show="e0:cb:4e:f6:97:3e" value="e0cb4ef6973e">
      <field name="eth.addr" showname="Address: AsustekC_f6:97:3e (e0:cb:4e:f6:97:3e)" size="6" pos="0" show="e0:cb:4e:f6:97:3e" value="e0cb4ef6973e"/>
      <field name="eth.lg" showname=".... ..0. .... .... .... .... = LG bit: Globally unique address (factory default)" size="3" pos="0" show="0" value="0" unmaskedvalue="e0cb4e"/>
      <field name="eth.ig" showname=".... ...0 .... .... .... .... = IG bit: Individual address (unicast)" size="3" pos="0" show="0" value="0" unmaskedvalue="e0cb4e"/>
    </field>
    <field name="eth.src" showname="Source: Pegatron_2f:4d:48 (4c:72:b9:2f:4d:48)" size="6" pos="6" show="4c:72:b9:2f:4d:48" value="4c72b92f4d48">
      <field name="eth.addr" showname="Address: Pegatron_2f:4d:48 (4c:72:b9:2f:4d:48)" size="6" pos="6" show="4c:72:b9:2f:4d:48" value="4c72b92f4d48"/>
      <field name="eth.lg" showname=".... ..0. .... .... .... .... = LG bit: Globally unique address (factory default)" size="3" pos="6" show="0" value="0" unmaskedvalue="4c72b9"/>
      <field name="eth.ig" showname=".... ...0 .... .... .... .... = IG bit: Individual address (unicast)" size="3" pos="6" show="0" value="0" unmaskedvalue="4c72b9"/>
    </field>
    <field name="eth.type" showname="Type: IP (0x0800)" size="2" pos="12" show="0x0800" value="0800"/>
  </proto>
  <proto name="ip" showname="Internet Protocol Version 4, Src: 10.48.1.195 (10.48.1.195), Dst: 134.153.48.1 (134.153.48.1)" size="20" pos="14">
    <field name="ip.version" showname="Version: 4" size="1" pos="14" show="4" value="45"/>
    <field name="ip.hdr_len" showname="Header length: 20 bytes" size="1" pos="14" show="20" value="45"/>
    <field name="ip.dsfield" showname="Differentiated Services Field: 0x00 (DSCP 0x00: Default; ECN: 0x00: Not-ECT (Not ECN-Capable Transport))" size="1" pos="15" show="0" value="00">
      <field name="ip.dsfield.dscp" showname="0000 00.. = Differentiated Services Codepoint: Default (0x00)" size="1" pos="15" show="0x00" value="0" unmaskedvalue="00"/>
      <field name="ip.dsfield.ecn" showname=".... ..00 = Explicit Congestion Notification: Not-ECT (Not ECN-Capable Transport) (0x00)" size="1" pos="15" show="0x00" value="0" unmaskedvalue="00"/>
    </field>
    <field name="ip.len" showname="Total Length: 60" size="2" pos="16" show="60" value="003c"/>
    <field name="ip.id" showname="Identification: 0xe386 (58246)" size="2" pos="18" show="0xe386" value="e386"/>
    <field name="ip.flags" showname="Flags: 0x02 (Don&apos;t Fragment)" size="1" pos="20" show="0x02" value="40">
      <field name="ip.flags.rb" showname="0... .... = Reserved bit: Not set" size="1" pos="20" show="0" value="40"/>
      <field name="ip.flags.df" showname=".1.. .... = Don&apos;t fragment: Set" size="1" pos="20" show="1" value="40"/>
      <field name="ip.flags.mf" showname="..0. .... = More fragments: Not set" size="1" pos="20" show="0" value="40"/>
    </field>
    <field name="ip.frag_offset" showname="Fragment offset: 0" size="2" pos="20" show="0" value="4000"/>
    <field name="ip.ttl" showname="Time to live: 64" size="1" pos="22" show="64" value="40"/>
    <field name="ip.proto" showname="Protocol: TCP (6)" size="1" pos="23" show="6" value="06"/>
    <field name="ip.checksum" showname="Header checksum: 0x94a8 [correct]" size="2" pos="24" show="0x94a8" value="94a8">
      <field name="ip.checksum_good" showname="Good: True" size="2" pos="24" show="1" value="94a8"/>
      <field name="ip.checksum_bad" showname="Bad: False" size="2" pos="24" show="0" value="94a8"/>
    </field>
    <field name="ip.src" showname="Source: 10.48.1.195 (10.48.1.195)" size="4" pos="26" show="10.48.1.195" value="0a3001c3"/>
    <field name="ip.addr" showname="Source or Destination Address: 10.48.1.195 (10.48.1.195)" hide="yes" size="4" pos="26" show="10.48.1.195" value="0a3001c3"/>
    <field name="ip.src_host" showname="Source Host: 10.48.1.195" hide="yes" size="4" pos="26" show="10.48.1.195" value="0a3001c3"/>
    <field name="ip.host" showname="Source or Destination Host: 10.48.1.195" hide="yes" size="4" pos="26" show="10.48.1.195" value="0a3001c3"/>
    <field name="ip.dst" showname="Destination: 134.153.48.1 (134.153.48.1)" size="4" pos="30" show="134.153.48.1" value="86993001"/>
    <field name="ip.addr" showname="Source or Destination Address: 134.153.48.1 (134.153.48.1)" hide="yes" size="4" pos="30" show="134.153.48.1" value="86993001"/>
    <field name="ip.dst_host" showname="Destination Host: 134.153.48.1" hide="yes" size="4" pos="30" show="134.153.48.1" value="86993001"/>
    <field name="ip.host" showname="Source or Destination Host: 134.153.48.1" hide="yes" size="4" pos="30" show="134.153.48.1" value="86993001"/>
    <field name="" show="Source GeoIP: Unknown" size="4" pos="26" value="0a3001c3"/>
    <field name="" show="Destination GeoIP: Unknown" size="4" pos="30" value="86993001"/>
  </proto>
  <proto name="tcp" showname="Transmission Control Protocol, Src Port: 54688 (54688), Dst Port: ssh (22), Seq: 0, Len: 0" size="40" pos="34">
    <field name="tcp.srcport" showname="Source port: 54688 (54688)" size="2" pos="34" show="54688" value="d5a0"/>
    <field name="tcp.dstport" showname="Destination port: ssh (22)" size="2" pos="36" show="22" value="0016"/>
    <field name="tcp.port" showname="Source or Destination Port: 54688" hide="yes" size="2" pos="34" show="54688" value="d5a0"/>
    <field name="tcp.port" showname="Source or Destination Port: 22" hide="yes" size="2" pos="36" show="22" value="0016"/>
    <field name="tcp.stream" showname="Stream index: 5" size="0" pos="34" show="5"/>
    <field name="tcp.len" showname="TCP Segment Len: 0" hide="yes" size="1" pos="46" show="0" value="a0"/>
    <field name="tcp.seq" showname="Sequence number: 0    (relative sequence number)" size="4" pos="38" show="0" value="884fc073"/>
    <field name="tcp.hdr_len" showname="Header length: 40 bytes" size="1" pos="46" show="40" value="a0"/>
    <field name="tcp.flags" showname="Flags: 0x002 (SYN)" size="2" pos="46" show="0x0002" value="2" unmaskedvalue="a002">
      <field name="tcp.flags.res" showname="000. .... .... = Reserved: Not set" size="1" pos="46" show="0" value="0" unmaskedvalue="a0"/>
      <field name="tcp.flags.ns" showname="...0 .... .... = Nonce: Not set" size="1" pos="46" show="0" value="0" unmaskedvalue="a0"/>
      <field name="tcp.flags.cwr" showname=".... 0... .... = Congestion Window Reduced (CWR): Not set" size="1" pos="47" show="0" value="0" unmaskedvalue="02"/>
      <field name="tcp.flags.ecn" showname=".... .0.. .... = ECN-Echo: Not set" size="1" pos="47" show="0" value="0" unmaskedvalue="02"/>
      <field name="tcp.flags.urg" showname=".... ..0. .... = Urgent: Not set" size="1" pos="47" show="0" value="0" unmaskedvalue="02"/>
      <field name="tcp.flags.ack" showname=".... ...0 .... = Acknowledgment: Not set" size="1" pos="47" show="0" value="0" unmaskedvalue="02"/>
      <field name="tcp.flags.push" showname=".... .... 0... = Push: Not set" size="1" pos="47" show="0" value="0" unmaskedvalue="02"/>
      <field name="tcp.flags.reset" showname=".... .... .0.. = Reset: Not set" size="1" pos="47" show="0" value="0" unmaskedvalue="02"/>
      <field name="tcp.flags.syn" showname=".... .... ..1. = Syn: Set" size="1" pos="47" show="1" value="1" unmaskedvalue="02">
        <field name="expert" showname="Expert Info (Chat/Sequence): Connection establish request (SYN): server port ssh" size="0" pos="47">
          <field name="expert.message" showname="Message: Connection establish request (SYN): server port ssh" size="0" pos="0" show="Connection establish request (SYN): server port ssh"/>
          <field name="expert.severity" showname="Severity level: Chat" size="0" pos="0" show="0x00200000"/>
          <field name="expert.group" showname="Group: Sequence" size="0" pos="0" show="0x02000000"/>
        </field>
      </field>
      <field name="tcp.flags.fin" showname=".... .... ...0 = Fin: Not set" size="1" pos="47" show="0" value="0" unmaskedvalue="02"/>
    </field>
    <field name="tcp.window_size_value" showname="Window size value: 29200" size="2" pos="48" show="29200" value="7210"/>
    <field name="tcp.window_size" showname="Calculated window size: 29200" size="2" pos="48" show="29200" value="7210"/>
    <field name="tcp.checksum" showname="Checksum: 0xd048 [validation disabled]" size="2" pos="50" show="0xd048" value="d048">
      <field name="tcp.checksum_good" showname="Good Checksum: False" size="2" pos="50" show="0" value="d048"/>
      <field name="tcp.checksum_bad" showname="Bad Checksum: False" size="2" pos="50" show="0" value="d048"/>
    </field>
    <field name="tcp.options" showname="Options: (20 bytes), Maximum segment size, SACK permitted, Timestamps, No-Operation (NOP), Window scale" size="20" pos="54" show="02:04:05:b4:04:02:08:0a:00:ab:23:f5:00:00:00:00:01:03:03:07" value="020405b40402080a00ab23f50000000001030307">
      <field name="tcp.options.mss" showname="Maximum segment size: 1460 bytes" size="4" pos="54" show="" value="">
        <field name="tcp.option_kind" showname="Kind: MSS size (2)" size="1" pos="54" show="2" value="02"/>
        <field name="tcp.option_len" showname="Length: 4" size="1" pos="55" show="4" value="04"/>
        <field name="tcp.options.mss_val" showname="MSS Value: 1460" size="2" pos="56" show="1460" value="05b4"/>
      </field>
      <field name="tcp.options.sack_perm" showname="TCP SACK Permitted Option: True" size="2" pos="58" show="1" value="0402">
        <field name="tcp.option_kind" showname="Kind: SACK Permission (4)" size="1" pos="58" show="4" value="04"/>
        <field name="tcp.option_len" showname="Length: 2" size="1" pos="59" show="2" value="02"/>
      </field>
      <field name="" show="Timestamps: TSval 11215861, TSecr 0" size="10" pos="60" value="080a00ab23f500000000">
        <field name="tcp.option_kind" showname="Kind: Timestamp (8)" size="1" pos="60" show="8" value="08"/>
        <field name="tcp.option_len" showname="Length: 10" size="1" pos="61" show="10" value="0a"/>
        <field name="tcp.options.timestamp.tsval" showname="Timestamp value: 11215861" size="4" pos="62" show="11215861" value="00ab23f5"/>
        <field name="tcp.options.timestamp.tsecr" showname="Timestamp echo reply: 0" size="4" pos="66" show="0" value="00000000"/>
      </field>
      <field name="" show="No-Operation (NOP)" size="1" pos="70" value="01">
        <field name="tcp.options.type" showname="Type: 1" size="1" pos="70" show="1" value="01">
          <field name="tcp.options.type.copy" showname="0... .... = Copy on fragmentation: No" size="1" pos="70" show="0" value="0" unmaskedvalue="01"/>
          <field name="tcp.options.type.class" showname=".00. .... = Class: Control (0)" size="1" pos="70" show="0" value="0" unmaskedvalue="01"/>
          <field name="tcp.options.type.number" showname="...0 0001 = Number: No-Operation (NOP) (1)" size="1" pos="70" show="1" value="1" unmaskedvalue="01"/>
        </field>
      </field>
      <field name="" show="Window scale: 7 (multiply by 128)" size="3" pos="71" value="030307">
        <field name="tcp.option_kind" showname="Kind: Window Scale (3)" size="1" pos="71" show="3" value="03"/>
        <field name="tcp.option_len" showname="Length: 3" size="1" pos="72" show="3" value="03"/>
        <field name="tcp.options.wscale.shift" showname="Shift count: 7" size="1" pos="73" show="7" value="07"/>
        <field name="tcp.options.wscale.multiplier" showname="Multiplier: 128" size="1" pos="73" show="128" value="07"/>
      </field>
    </field>
  </proto>
</packet>

<packet>
  <proto name="geninfo" pos="0" showname="General information" size="74">
    <field name="num" pos="0" show="1925" showname="Number" value="785" size="74"/>
    <field name="len" pos="0" show="74" showname="Frame Length" value="4a" size="74"/>
    <field name="caplen" pos="0" show="74" showname="Captured Length" value="4a" size="74"/>
    <field name="timestamp" pos="0" show="Jan  3, 2014 21:27:11.900472000 NST" showname="Captured Time" value="1388797031.900472000" size="74"/>
  </proto>
  <proto name="frame" showname="Frame 1925: 74 bytes on wire (592 bits), 74 bytes captured (592 bits) on interface 0" size="74" pos="0">
    <field name="frame.interface_id" showname="Interface id: 0" size="0" pos="0" show="0"/>
    <field name="frame.encap_type" showname="Encapsulation type: Ethernet (1)" size="0" pos="0" show="1"/>
    <field name="frame.time" showname="Arrival Time: Jan  3, 2014 21:27:11.900472000 NST" size="0" pos="0" show="Jan  3, 2014 21:27:11.900472000"/>
    <field name="frame.offset_shift" showname="Time shift for this packet: 0.000000000 seconds" size="0" pos="0" show="0.000000000"/>
    <field name="frame.time_epoch" showname="Epoch Time: 1388797031.900472000 seconds" size="0" pos="0" show="1388797031.900472000"/>
    <field name="frame.time_delta" showname="Time delta from previous captured frame: 0.005698000 seconds" size="0" pos="0" show="0.005698000"/>
    <field name="frame.time_delta_displayed" showname="Time delta from previous displayed frame: 0.005698000 seconds" size="0" pos="0" show="0.005698000"/>
    <field name="frame.time_relative" showname="Time since reference or first frame: 66.491153000 seconds" size="0" pos="0" show="66.491153000"/>
    <field name="frame.number" showname="Frame Number: 1925" size="0" pos="0" show="1925"/>
    <field name="frame.len" showname="Frame Length: 74 bytes (592 bits)" size="0" pos="0" show="74"/>
    <field name="frame.cap_len" showname="Capture Length: 74 bytes (592 bits)" size="0" pos="0" show="74"/>
    <field name="frame.marked" showname="Frame is marked: True" size="0" pos="0" show="1"/>
    <field name="frame.ignored" showname="Frame is ignored: False" size="0" pos="0" show="0"/>
    <field name="frame.protocols" showname="Protocols in frame: eth:ip:tcp" size="0" pos="0" show="eth:ip:tcp"/>
    <field name="frame.coloring_rule.name" showname="Coloring Rule Name: TCP SYN/FIN" size="0" pos="0" show="TCP SYN/FIN"/>
    <field name="frame.coloring_rule.string" showname="Coloring Rule String: tcp.flags &amp; 0x02 || tcp.flags.fin == 1" size="0" pos="0" show="tcp.flags &amp; 0x02 || tcp.flags.fin == 1"/>
  </proto>
  <proto name="eth" showname="Ethernet II, Src: AsustekC_f6:97:3e (e0:cb:4e:f6:97:3e), Dst: Pegatron_2f:4d:48 (4c:72:b9:2f:4d:48)" size="14" pos="0">
    <field name="eth.dst" showname="Destination: Pegatron_2f:4d:48 (4c:72:b9:2f:4d:48)" size="6" pos="0" show="4c:72:b9:2f:4d:48" value="4c72b92f4d48">
      <field name="eth.addr" showname="Address: Pegatron_2f:4d:48 (4c:72:b9:2f:4d:48)" size="6" pos="0" show="4c:72:b9:2f:4d:48" value="4c72b92f4d48"/>
      <field name="eth.lg" showname=".... ..0. .... .... .... .... = LG bit: Globally unique address (factory default)" size="3" pos="0" show="0" value="0" unmaskedvalue="4c72b9"/>
      <field name="eth.ig" showname=".... ...0 .... .... .... .... = IG bit: Individual address (unicast)" size="3" pos="0" show="0" value="0" unmaskedvalue="4c72b9"/>
    </field>
    <field name="eth.src" showname="Source: AsustekC_f6:97:3e (e0:cb:4e:f6:97:3e)" size="6" pos="6" show="e0:cb:4e:f6:97:3e" value="e0cb4ef6973e">
      <field name="eth.addr" showname="Address: AsustekC_f6:97:3e (e0:cb:4e:f6:97:3e)" size="6" pos="6" show="e0:cb:4e:f6:97:3e" value="e0cb4ef6973e"/>
      <field name="eth.lg" showname=".... ..0. .... .... .... .... = LG bit: Globally unique address (factory default)" size="3" pos="6" show="0" value="0" unmaskedvalue="e0cb4e"/>
      <field name="eth.ig" showname=".... ...0 .... .... .... .... = IG bit: Individual address (unicast)" size="3" pos="6" show="0" value="0" unmaskedvalue="e0cb4e"/>
    </field>
    <field name="eth.type" showname="Type: IP (0x0800)" size="2" pos="12" show="0x0800" value="0800"/>
  </proto>
  <proto name="ip" showname="Internet Protocol Version 4, Src: 134.153.48.1 (134.153.48.1), Dst: 10.48.1.195 (10.48.1.195)" size="20" pos="14">
    <field name="ip.version" showname="Version: 4" size="1" pos="14" show="4" value="45"/>
    <field name="ip.hdr_len" showname="Header length: 20 bytes" size="1" pos="14" show="20" value="45"/>
    <field name="ip.dsfield" showname="Differentiated Services Field: 0x00 (DSCP 0x00: Default; ECN: 0x00: Not-ECT (Not ECN-Capable Transport))" size="1" pos="15" show="0" value="00">
      <field name="ip.dsfield.dscp" showname="0000 00.. = Differentiated Services Codepoint: Default (0x00)" size="1" pos="15" show="0x00" value="0" unmaskedvalue="00"/>
      <field name="ip.dsfield.ecn" showname=".... ..00 = Explicit Congestion Notification: Not-ECT (Not ECN-Capable Transport) (0x00)" size="1" pos="15" show="0x00" value="0" unmaskedvalue="00"/>
    </field>
    <field name="ip.len" showname="Total Length: 60" size="2" pos="16" show="60" value="003c"/>
    <field name="ip.id" showname="Identification: 0x0000 (0)" size="2" pos="18" show="0x0000" value="0000"/>
    <field name="ip.flags" showname="Flags: 0x02 (Don&apos;t Fragment)" size="1" pos="20" show="0x02" value="40">
      <field name="ip.flags.rb" showname="0... .... = Reserved bit: Not set" size="1" pos="20" show="0" value="40"/>
      <field name="ip.flags.df" showname=".1.. .... = Don&apos;t fragment: Set" size="1" pos="20" show="1" value="40"/>
      <field name="ip.flags.mf" showname="..0. .... = More fragments: Not set" size="1" pos="20" show="0" value="40"/>
    </field>
    <field name="ip.frag_offset" showname="Fragment offset: 0" size="2" pos="20" show="0" value="4000"/>
    <field name="ip.ttl" showname="Time to live: 56" size="1" pos="22" show="56" value="38"/>
    <field name="ip.proto" showname="Protocol: TCP (6)" size="1" pos="23" show="6" value="06"/>
    <field name="ip.checksum" showname="Header checksum: 0x802f [correct]" size="2" pos="24" show="0x802f" value="802f">
      <field name="ip.checksum_good" showname="Good: True" size="2" pos="24" show="1" value="802f"/>
      <field name="ip.checksum_bad" showname="Bad: False" size="2" pos="24" show="0" value="802f"/>
    </field>
    <field name="ip.src" showname="Source: 134.153.48.1 (134.153.48.1)" size="4" pos="26" show="134.153.48.1" value="86993001"/>
    <field name="ip.addr" showname="Source or Destination Address: 134.153.48.1 (134.153.48.1)" hide="yes" size="4" pos="26" show="134.153.48.1" value="86993001"/>
    <field name="ip.src_host" showname="Source Host: 134.153.48.1" hide="yes" size="4" pos="26" show="134.153.48.1" value="86993001"/>
    <field name="ip.host" showname="Source or Destination Host: 134.153.48.1" hide="yes" size="4" pos="26" show="134.153.48.1" value="86993001"/>
    <field name="ip.dst" showname="Destination: 10.48.1.195 (10.48.1.195)" size="4" pos="30" show="10.48.1.195" value="0a3001c3"/>
    <field name="ip.addr" showname="Source or Destination Address: 10.48.1.195 (10.48.1.195)" hide="yes" size="4" pos="30" show="10.48.1.195" value="0a3001c3"/>
    <field name="ip.dst_host" showname="Destination Host: 10.48.1.195" hide="yes" size="4" pos="30" show="10.48.1.195" value="0a3001c3"/>
    <field name="ip.host" showname="Source or Destination Host: 10.48.1.195" hide="yes" size="4" pos="30" show="10.48.1.195" value="0a3001c3"/>
    <field name="" show="Source GeoIP: Unknown" size="4" pos="26" value="86993001"/>
    <field name="" show="Destination GeoIP: Unknown" size="4" pos="30" value="0a3001c3"/>
  </proto>
  <proto name="tcp" showname="Transmission Control Protocol, Src Port: ssh (22), Dst Port: 54688 (54688), Seq: 0, Ack: 1, Len: 0" size="40" pos="34">
    <field name="tcp.srcport" showname="Source port: ssh (22)" size="2" pos="34" show="22" value="0016"/>
    <field name="tcp.dstport" showname="Destination port: 54688 (54688)" size="2" pos="36" show="54688" value="d5a0"/>
    <field name="tcp.port" showname="Source or Destination Port: 22" hide="yes" size="2" pos="34" show="22" value="0016"/>
    <field name="tcp.port" showname="Source or Destination Port: 54688" hide="yes" size="2" pos="36" show="54688" value="d5a0"/>
    <field name="tcp.stream" showname="Stream index: 5" size="0" pos="34" show="5"/>
    <field name="tcp.len" showname="TCP Segment Len: 0" hide="yes" size="1" pos="46" show="0" value="a0"/>
    <field name="tcp.seq" showname="Sequence number: 0    (relative sequence number)" size="4" pos="38" show="0" value="64b74976"/>
    <field name="tcp.ack" showname="Acknowledgment number: 1    (relative ack number)" size="4" pos="42" show="1" value="884fc074"/>
    <field name="tcp.hdr_len" showname="Header length: 40 bytes" size="1" pos="46" show="40" value="a0"/>
    <field name="tcp.flags" showname="Flags: 0x012 (SYN, ACK)" size="2" pos="46" show="0x0012" value="12" unmaskedvalue="a012">
      <field name="tcp.flags.res" showname="000. .... .... = Reserved: Not set" size="1" pos="46" show="0" value="0" unmaskedvalue="a0"/>
      <field name="tcp.flags.ns" showname="...0 .... .... = Nonce: Not set" size="1" pos="46" show="0" value="0" unmaskedvalue="a0"/>
      <field name="tcp.flags.cwr" showname=".... 0... .... = Congestion Window Reduced (CWR): Not set" size="1" pos="47" show="0" value="0" unmaskedvalue="12"/>
      <field name="tcp.flags.ecn" showname=".... .0.. .... = ECN-Echo: Not set" size="1" pos="47" show="0" value="0" unmaskedvalue="12"/>
      <field name="tcp.flags.urg" showname=".... ..0. .... = Urgent: Not set" size="1" pos="47" show="0" value="0" unmaskedvalue="12"/>
      <field name="tcp.flags.ack" showname=".... ...1 .... = Acknowledgment: Set" size="1" pos="47" show="1" value="1" unmaskedvalue="12"/>
      <field name="tcp.flags.push" showname=".... .... 0... = Push: Not set" size="1" pos="47" show="0" value="0" unmaskedvalue="12"/>
      <field name="tcp.flags.reset" showname=".... .... .0.. = Reset: Not set" size="1" pos="47" show="0" value="0" unmaskedvalue="12"/>
      <field name="tcp.flags.syn" showname=".... .... ..1. = Syn: Set" size="1" pos="47" show="1" value="1" unmaskedvalue="12">
        <field name="expert" showname="Expert Info (Chat/Sequence): Connection establish acknowledge (SYN+ACK): server port ssh" size="0" pos="47">
          <field name="expert.message" showname="Message: Connection establish acknowledge (SYN+ACK): server port ssh" size="0" pos="0" show="Connection establish acknowledge (SYN+ACK): server port ssh"/>
          <field name="expert.severity" showname="Severity level: Chat" size="0" pos="0" show="0x00200000"/>
          <field name="expert.group" showname="Group: Sequence" size="0" pos="0" show="0x02000000"/>
        </field>
      </field>
      <field name="tcp.flags.fin" showname=".... .... ...0 = Fin: Not set" size="1" pos="47" show="0" value="0" unmaskedvalue="12"/>
    </field>
    <field name="tcp.window_size_value" showname="Window size value: 14480" size="2" pos="48" show="14480" value="3890"/>
    <field name="tcp.window_size" showname="Calculated window size: 14480" size="2" pos="48" show="14480" value="3890"/>
    <field name="tcp.checksum" showname="Checksum: 0xe3b7 [validation disabled]" size="2" pos="50" show="0xe3b7" value="e3b7">
      <field name="tcp.checksum_good" showname="Good Checksum: False" size="2" pos="50" show="0" value="e3b7"/>
      <field name="tcp.checksum_bad" showname="Bad Checksum: False" size="2" pos="50" show="0" value="e3b7"/>
    </field>
    <field name="tcp.options" showname="Options: (20 bytes), Maximum segment size, SACK permitted, Timestamps, No-Operation (NOP), Window scale" size="20" pos="54" show="02:04:05:64:04:02:08:0a:0f:d5:68:4d:00:ab:23:f5:01:03:03:07" value="020405640402080a0fd5684d00ab23f501030307">
      <field name="tcp.options.mss" showname="Maximum segment size: 1380 bytes" size="4" pos="54" show="" value="">
        <field name="tcp.option_kind" showname="Kind: MSS size (2)" size="1" pos="54" show="2" value="02"/>
        <field name="tcp.option_len" showname="Length: 4" size="1" pos="55" show="4" value="04"/>
        <field name="tcp.options.mss_val" showname="MSS Value: 1380" size="2" pos="56" show="1380" value="0564"/>
      </field>
      <field name="tcp.options.sack_perm" showname="TCP SACK Permitted Option: True" size="2" pos="58" show="1" value="0402">
        <field name="tcp.option_kind" showname="Kind: SACK Permission (4)" size="1" pos="58" show="4" value="04"/>
        <field name="tcp.option_len" showname="Length: 2" size="1" pos="59" show="2" value="02"/>
      </field>
      <field name="" show="Timestamps: TSval 265644109, TSecr 11215861" size="10" pos="60" value="080a0fd5684d00ab23f5">
        <field name="tcp.option_kind" showname="Kind: Timestamp (8)" size="1" pos="60" show="8" value="08"/>
        <field name="tcp.option_len" showname="Length: 10" size="1" pos="61" show="10" value="0a"/>
        <field name="tcp.options.timestamp.tsval" showname="Timestamp value: 265644109" size="4" pos="62" show="265644109" value="0fd5684d"/>
        <field name="tcp.options.timestamp.tsecr" showname="Timestamp echo reply: 11215861" size="4" pos="66" show="11215861" value="00ab23f5"/>
      </field>
      <field name="" show="No-Operation (NOP)" size="1" pos="70" value="01">
        <field name="tcp.options.type" showname="Type: 1" size="1" pos="70" show="1" value="01">
          <field name="tcp.options.type.copy" showname="0... .... = Copy on fragmentation: No" size="1" pos="70" show="0" value="0" unmaskedvalue="01"/>
          <field name="tcp.options.type.class" showname=".00. .... = Class: Control (0)" size="1" pos="70" show="0" value="0" unmaskedvalue="01"/>
          <field name="tcp.options.type.number" showname="...0 0001 = Number: No-Operation (NOP) (1)" size="1" pos="70" show="1" value="1" unmaskedvalue="01"/>
        </field>
      </field>
      <field name="" show="Window scale: 7 (multiply by 128)" size="3" pos="71" value="030307">
        <field name="tcp.option_kind" showname="Kind: Window Scale (3)" size="1" pos="71" show="3" value="03"/>
        <field name="tcp.option_len" showname="Length: 3" size="1" pos="72" show="3" value="03"/>
        <field name="tcp.options.wscale.shift" showname="Shift count: 7" size="1" pos="73" show="7" value="07"/>
        <field name="tcp.options.wscale.multiplier" showname="Multiplier: 128" size="1" pos="73" show="128" value="07"/>
      </field>
    </field>
    <field name="tcp.analysis" showname="SEQ/ACK analysis" size="0" pos="34" show="" value="">
      <field name="tcp.analysis.acks_frame" showname="This is an ACK to the segment in frame: 1924" size="0" pos="34" show="1924"/>
      <field name="tcp.analysis.ack_rtt" showname="The RTT to ACK the segment was: 0.005698000 seconds" size="0" pos="34" show="0.005698000"/>
    </field>
  </proto>
</packet>

<packet>
  <proto name="geninfo" pos="0" showname="General information" size="66">
    <field name="num" pos="0" show="1926" showname="Number" value="786" size="66"/>
    <field name="len" pos="0" show="66" showname="Frame Length" value="42" size="66"/>
    <field name="caplen" pos="0" show="66" showname="Captured Length" value="42" size="66"/>
    <field name="timestamp" pos="0" show="Jan  3, 2014 21:27:11.900569000 NST" showname="Captured Time" value="1388797031.900569000" size="66"/>
  </proto>
  <proto name="frame" showname="Frame 1926: 66 bytes on wire (528 bits), 66 bytes captured (528 bits) on interface 0" size="66" pos="0">
    <field name="frame.interface_id" showname="Interface id: 0" size="0" pos="0" show="0"/>
    <field name="frame.encap_type" showname="Encapsulation type: Ethernet (1)" size="0" pos="0" show="1"/>
    <field name="frame.time" showname="Arrival Time: Jan  3, 2014 21:27:11.900569000 NST" size="0" pos="0" show="Jan  3, 2014 21:27:11.900569000"/>
    <field name="frame.offset_shift" showname="Time shift for this packet: 0.000000000 seconds" size="0" pos="0" show="0.000000000"/>
    <field name="frame.time_epoch" showname="Epoch Time: 1388797031.900569000 seconds" size="0" pos="0" show="1388797031.900569000"/>
    <field name="frame.time_delta" showname="Time delta from previous captured frame: 0.000097000 seconds" size="0" pos="0" show="0.000097000"/>
    <field name="frame.time_delta_displayed" showname="Time delta from previous displayed frame: 0.000097000 seconds" size="0" pos="0" show="0.000097000"/>
    <field name="frame.time_relative" showname="Time since reference or first frame: 66.491250000 seconds" size="0" pos="0" show="66.491250000"/>
    <field name="frame.number" showname="Frame Number: 1926" size="0" pos="0" show="1926"/>
    <field name="frame.len" showname="Frame Length: 66 bytes (528 bits)" size="0" pos="0" show="66"/>
    <field name="frame.cap_len" showname="Capture Length: 66 bytes (528 bits)" size="0" pos="0" show="66"/>
    <field name="frame.marked" showname="Frame is marked: True" size="0" pos="0" show="1"/>
    <field name="frame.ignored" showname="Frame is ignored: False" size="0" pos="0" show="0"/>
    <field name="frame.protocols" showname="Protocols in frame: eth:ip:tcp" size="0" pos="0" show="eth:ip:tcp"/>
    <field name="frame.coloring_rule.name" showname="Coloring Rule Name: TCP" size="0" pos="0" show="TCP"/>
    <field name="frame.coloring_rule.string" showname="Coloring Rule String: tcp" size="0" pos="0" show="tcp"/>
  </proto>
  <proto name="eth" showname="Ethernet II, Src: Pegatron_2f:4d:48 (4c:72:b9:2f:4d:48), Dst: AsustekC_f6:97:3e (e0:cb:4e:f6:97:3e)" size="14" pos="0">
    <field name="eth.dst" showname="Destination: AsustekC_f6:97:3e (e0:cb:4e:f6:97:3e)" size="6" pos="0" show="e0:cb:4e:f6:97:3e" value="e0cb4ef6973e">
      <field name="eth.addr" showname="Address: AsustekC_f6:97:3e (e0:cb:4e:f6:97:3e)" size="6" pos="0" show="e0:cb:4e:f6:97:3e" value="e0cb4ef6973e"/>
      <field name="eth.lg" showname=".... ..0. .... .... .... .... = LG bit: Globally unique address (factory default)" size="3" pos="0" show="0" value="0" unmaskedvalue="e0cb4e"/>
      <field name="eth.ig" showname=".... ...0 .... .... .... .... = IG bit: Individual address (unicast)" size="3" pos="0" show="0" value="0" unmaskedvalue="e0cb4e"/>
    </field>
    <field name="eth.src" showname="Source: Pegatron_2f:4d:48 (4c:72:b9:2f:4d:48)" size="6" pos="6" show="4c:72:b9:2f:4d:48" value="4c72b92f4d48">
      <field name="eth.addr" showname="Address: Pegatron_2f:4d:48 (4c:72:b9:2f:4d:48)" size="6" pos="6" show="4c:72:b9:2f:4d:48" value="4c72b92f4d48"/>
      <field name="eth.lg" showname=".... ..0. .... .... .... .... = LG bit: Globally unique address (factory default)" size="3" pos="6" show="0" value="0" unmaskedvalue="4c72b9"/>
      <field name="eth.ig" showname=".... ...0 .... .... .... .... = IG bit: Individual address (unicast)" size="3" pos="6" show="0" value="0" unmaskedvalue="4c72b9"/>
    </field>
    <field name="eth.type" showname="Type: IP (0x0800)" size="2" pos="12" show="0x0800" value="0800"/>
  </proto>
  <proto name="ip" showname="Internet Protocol Version 4, Src: 10.48.1.195 (10.48.1.195), Dst: 134.153.48.1 (134.153.48.1)" size="20" pos="14">
    <field name="ip.version" showname="Version: 4" size="1" pos="14" show="4" value="45"/>
    <field name="ip.hdr_len" showname="Header length: 20 bytes" size="1" pos="14" show="20" value="45"/>
    <field name="ip.dsfield" showname="Differentiated Services Field: 0x00 (DSCP 0x00: Default; ECN: 0x00: Not-ECT (Not ECN-Capable Transport))" size="1" pos="15" show="0" value="00">
      <field name="ip.dsfield.dscp" showname="0000 00.. = Differentiated Services Codepoint: Default (0x00)" size="1" pos="15" show="0x00" value="0" unmaskedvalue="00"/>
      <field name="ip.dsfield.ecn" showname=".... ..00 = Explicit Congestion Notification: Not-ECT (Not ECN-Capable Transport) (0x00)" size="1" pos="15" show="0x00" value="0" unmaskedvalue="00"/>
    </field>
    <field name="ip.len" showname="Total Length: 52" size="2" pos="16" show="52" value="0034"/>
    <field name="ip.id" showname="Identification: 0xe387 (58247)" size="2" pos="18" show="0xe387" value="e387"/>
    <field name="ip.flags" showname="Flags: 0x02 (Don&apos;t Fragment)" size="1" pos="20" show="0x02" value="40">
      <field name="ip.flags.rb" showname="0... .... = Reserved bit: Not set" size="1" pos="20" show="0" value="40"/>
      <field name="ip.flags.df" showname=".1.. .... = Don&apos;t fragment: Set" size="1" pos="20" show="1" value="40"/>
      <field name="ip.flags.mf" showname="..0. .... = More fragments: Not set" size="1" pos="20" show="0" value="40"/>
    </field>
    <field name="ip.frag_offset" showname="Fragment offset: 0" size="2" pos="20" show="0" value="4000"/>
    <field name="ip.ttl" showname="Time to live: 64" size="1" pos="22" show="64" value="40"/>
    <field name="ip.proto" showname="Protocol: TCP (6)" size="1" pos="23" show="6" value="06"/>
    <field name="ip.checksum" showname="Header checksum: 0x94af [correct]" size="2" pos="24" show="0x94af" value="94af">
      <field name="ip.checksum_good" showname="Good: True" size="2" pos="24" show="1" value="94af"/>
      <field name="ip.checksum_bad" showname="Bad: False" size="2" pos="24" show="0" value="94af"/>
    </field>
    <field name="ip.src" showname="Source: 10.48.1.195 (10.48.1.195)" size="4" pos="26" show="10.48.1.195" value="0a3001c3"/>
    <field name="ip.addr" showname="Source or Destination Address: 10.48.1.195 (10.48.1.195)" hide="yes" size="4" pos="26" show="10.48.1.195" value="0a3001c3"/>
    <field name="ip.src_host" showname="Source Host: 10.48.1.195" hide="yes" size="4" pos="26" show="10.48.1.195" value="0a3001c3"/>
    <field name="ip.host" showname="Source or Destination Host: 10.48.1.195" hide="yes" size="4" pos="26" show="10.48.1.195" value="0a3001c3"/>
    <field name="ip.dst" showname="Destination: 134.153.48.1 (134.153.48.1)" size="4" pos="30" show="134.153.48.1" value="86993001"/>
    <field name="ip.addr" showname="Source or Destination Address: 134.153.48.1 (134.153.48.1)" hide="yes" size="4" pos="30" show="134.153.48.1" value="86993001"/>
    <field name="ip.dst_host" showname="Destination Host: 134.153.48.1" hide="yes" size="4" pos="30" show="134.153.48.1" value="86993001"/>
    <field name="ip.host" showname="Source or Destination Host: 134.153.48.1" hide="yes" size="4" pos="30" show="134.153.48.1" value="86993001"/>
    <field name="" show="Source GeoIP: Unknown" size="4" pos="26" value="0a3001c3"/>
    <field name="" show="Destination GeoIP: Unknown" size="4" pos="30" value="86993001"/>
  </proto>
  <proto name="tcp" showname="Transmission Control Protocol, Src Port: 54688 (54688), Dst Port: ssh (22), Seq: 1, Ack: 1, Len: 0" size="32" pos="34">
    <field name="tcp.srcport" showname="Source port: 54688 (54688)" size="2" pos="34" show="54688" value="d5a0"/>
    <field name="tcp.dstport" showname="Destination port: ssh (22)" size="2" pos="36" show="22" value="0016"/>
    <field name="tcp.port" showname="Source or Destination Port: 54688" hide="yes" size="2" pos="34" show="54688" value="d5a0"/>
    <field name="tcp.port" showname="Source or Destination Port: 22" hide="yes" size="2" pos="36" show="22" value="0016"/>
    <field name="tcp.stream" showname="Stream index: 5" size="0" pos="34" show="5"/>
    <field name="tcp.len" showname="TCP Segment Len: 0" hide="yes" size="1" pos="46" show="0" value="80"/>
    <field name="tcp.seq" showname="Sequence number: 1    (relative sequence number)" size="4" pos="38" show="1" value="884fc074"/>
    <field name="tcp.ack" showname="Acknowledgment number: 1    (relative ack number)" size="4" pos="42" show="1" value="64b74977"/>
    <field name="tcp.hdr_len" showname="Header length: 32 bytes" size="1" pos="46" show="32" value="80"/>
    <field name="tcp.flags" showname="Flags: 0x010 (ACK)" size="2" pos="46" show="0x0010" value="10" unmaskedvalue="8010">
      <field name="tcp.flags.res" showname="000. .... .... = Reserved: Not set" size="1" pos="46" show="0" value="0" unmaskedvalue="80"/>
      <field name="tcp.flags.ns" showname="...0 .... .... = Nonce: Not set" size="1" pos="46" show="0" value="0" unmaskedvalue="80"/>
      <field name="tcp.flags.cwr" showname=".... 0... .... = Congestion Window Reduced (CWR): Not set" size="1" pos="47" show="0" value="0" unmaskedvalue="10"/>
      <field name="tcp.flags.ecn" showname=".... .0.. .... = ECN-Echo: Not set" size="1" pos="47" show="0" value="0" unmaskedvalue="10"/>
      <field name="tcp.flags.urg" showname=".... ..0. .... = Urgent: Not set" size="1" pos="47" show="0" value="0" unmaskedvalue="10"/>
      <field name="tcp.flags.ack" showname=".... ...1 .... = Acknowledgment: Set" size="1" pos="47" show="1" value="1" unmaskedvalue="10"/>
      <field name="tcp.flags.push" showname=".... .... 0... = Push: Not set" size="1" pos="47" show="0" value="0" unmaskedvalue="10"/>
      <field name="tcp.flags.reset" showname=".... .... .0.. = Reset: Not set" size="1" pos="47" show="0" value="0" unmaskedvalue="10"/>
