<?xml version="1.0"?>
<?xml-stylesheet type="text/xsl" href="pdml2html.xsl"?>
<!-- You can find pdml2html.xsl in /usr/share/wireshark or at http://anonsvn.wireshark.org/trunk/wireshark/pdml2html.xsl. -->
<pdml version="0" creator="wireshark/1.10.2" time="Fri Jan  3 20:58:38 2014" capture_file="/tmp/wireshark_pcapng_eth0_20140103205250_3OR1j3">
<packet>
  <proto name="geninfo" pos="0" showname="General information" size="74">
    <field name="num" pos="0" show="188" showname="Number" value="bc" size="74"/>
    <field name="len" pos="0" show="74" showname="Frame Length" value="4a" size="74"/>
    <field name="caplen" pos="0" show="74" showname="Captured Length" value="4a" size="74"/>
    <field name="timestamp" pos="0" show="Jan  3, 2014 20:54:55.336137000 NST" showname="Captured Time" value="1388795095.336137000" size="74"/>
  </proto>
  <proto name="frame" showname="Frame 188: 74 bytes on wire (592 bits), 74 bytes captured (592 bits) on interface 0" size="74" pos="0">
    <field name="frame.interface_id" showname="Interface id: 0" size="0" pos="0" show="0"/>
    <field name="frame.encap_type" showname="Encapsulation type: Ethernet (1)" size="0" pos="0" show="1"/>
    <field name="frame.time" showname="Arrival Time: Jan  3, 2014 20:54:55.336137000 NST" size="0" pos="0" show="Jan  3, 2014 20:54:55.336137000"/>
    <field name="frame.offset_shift" showname="Time shift for this packet: 0.000000000 seconds" size="0" pos="0" show="0.000000000"/>
    <field name="frame.time_epoch" showname="Epoch Time: 1388795095.336137000 seconds" size="0" pos="0" show="1388795095.336137000"/>
    <field name="frame.time_delta" showname="Time delta from previous captured frame: 0.000282000 seconds" size="0" pos="0" show="0.000282000"/>
    <field name="frame.time_delta_displayed" showname="Time delta from previous displayed frame: 0.000000000 seconds" size="0" pos="0" show="0.000000000"/>
    <field name="frame.time_relative" showname="Time since reference or first frame: 116.363197000 seconds" size="0" pos="0" show="116.363197000"/>
    <field name="frame.number" showname="Frame Number: 188" size="0" pos="0" show="188"/>
    <field name="frame.len" showname="Frame Length: 74 bytes (592 bits)" size="0" pos="0" show="74"/>
    <field name="frame.cap_len" showname="Capture Length: 74 bytes (592 bits)" size="0" pos="0" show="74"/>
    <field name="frame.marked" showname="Frame is marked: True" size="0" pos="0" show="1"/>
    <field name="frame.ignored" showname="Frame is ignored: False" size="0" pos="0" show="0"/>
    <field name="frame.protocols" showname="Protocols in frame: eth:ip:tcp" size="0" pos="0" show="eth:ip:tcp"/>
    <field name="frame.coloring_rule.name" showname="Coloring Rule Name: HTTP" size="0" pos="0" show="HTTP"/>
    <field name="frame.coloring_rule.string" showname="Coloring Rule String: http || tcp.port == 80" size="0" pos="0" show="http || tcp.port == 80"/>
  </proto>
  <proto name="eth" showname="Ethernet II, Src: Pegatron_2f:4d:48 (4c:72:b9:2f:4d:48), Dst: AsustekC_f6:97:3e (e0:cb:4e:f6:97:3e)" size="14" pos="0">
    <field name="eth.dst" showname="Destination: AsustekC_f6:97:3e (e0:cb:4e:f6:97:3e)" size="6" pos="0" show="e0:cb:4e:f6:97:3e" value="e0cb4ef6973e">
      <field name="eth.addr" showname="Address: AsustekC_f6:97:3e (e0:cb:4e:f6:97:3e)" size="6" pos="0" show="e0:cb:4e:f6:97:3e" value="e0cb4ef6973e"/>
      <field name="eth.lg" showname=".... ..0. .... .... .... .... = LG bit: Globally unique address (factory default)" size="3" pos="0" show="0" value="0" unmaskedvalue="e0cb4e"/>
      <field name="eth.ig" showname=".... ...0 .... .... .... .... = IG bit: Individual address (unicast)" size="3" pos="0" show="0" value="0" unmaskedvalue="e0cb4e"/>
    </field>
    <field name="eth.src" showname="Source: Pegatron_2f:4d:48 (4c:72:b9:2f:4d:48)" size="6" pos="6" show="4c:72:b9:2f:4d:48" value="4c72b92f4d48">
      <field name="eth.addr" showname="Address: Pegatron_2f:4d:48 (4c:72:b9:2f:4d:48)" size="6" pos="6" show="4c:72:b9:2f:4d:48" value="4c72b92f4d48"/>
      <field name="eth.lg" showname=".... ..0. .... .... .... .... = LG bit: Globally unique address (factory default)" size="3" pos="6" show="0" value="0" unmaskedvalue="4c72b9"/>
      <field name="eth.ig" showname=".... ...0 .... .... .... .... = IG bit: Individual address (unicast)" size="3" pos="6" show="0" value="0" unmaskedvalue="4c72b9"/>
    </field>
    <field name="eth.type" showname="Type: IP (0x0800)" size="2" pos="12" show="0x0800" value="0800"/>
  </proto>
  <proto name="ip" showname="Internet Protocol Version 4, Src: 10.48.1.195 (10.48.1.195), Dst: 134.153.48.5 (134.153.48.5)" size="20" pos="14">
    <field name="ip.version" showname="Version: 4" size="1" pos="14" show="4" value="45"/>
    <field name="ip.hdr_len" showname="Header length: 20 bytes" size="1" pos="14" show="20" value="45"/>
    <field name="ip.dsfield" showname="Differentiated Services Field: 0x00 (DSCP 0x00: Default; ECN: 0x00: Not-ECT (Not ECN-Capable Transport))" size="1" pos="15" show="0" value="00">
      <field name="ip.dsfield.dscp" showname="0000 00.. = Differentiated Services Codepoint: Default (0x00)" size="1" pos="15" show="0x00" value="0" unmaskedvalue="00"/>
      <field name="ip.dsfield.ecn" showname=".... ..00 = Explicit Congestion Notification: Not-ECT (Not ECN-Capable Transport) (0x00)" size="1" pos="15" show="0x00" value="0" unmaskedvalue="00"/>
    </field>
    <field name="ip.len" showname="Total Length: 60" size="2" pos="16" show="60" value="003c"/>
    <field name="ip.id" showname="Identification: 0xb715 (46869)" size="2" pos="18" show="0xb715" value="b715"/>
    <field name="ip.flags" showname="Flags: 0x02 (Don&apos;t Fragment)" size="1" pos="20" show="0x02" value="40">
      <field name="ip.flags.rb" showname="0... .... = Reserved bit: Not set" size="1" pos="20" show="0" value="40"/>
      <field name="ip.flags.df" showname=".1.. .... = Don&apos;t fragment: Set" size="1" pos="20" show="1" value="40"/>
      <field name="ip.flags.mf" showname="..0. .... = More fragments: Not set" size="1" pos="20" show="0" value="40"/>
    </field>
    <field name="ip.frag_offset" showname="Fragment offset: 0" size="2" pos="20" show="0" value="4000"/>
    <field name="ip.ttl" showname="Time to live: 64" size="1" pos="22" show="64" value="40"/>
    <field name="ip.proto" showname="Protocol: TCP (6)" size="1" pos="23" show="6" value="06"/>
    <field name="ip.checksum" showname="Header checksum: 0xc115 [correct]" size="2" pos="24" show="0xc115" value="c115">
      <field name="ip.checksum_good" showname="Good: True" size="2" pos="24" show="1" value="c115"/>
      <field name="ip.checksum_bad" showname="Bad: False" size="2" pos="24" show="0" value="c115"/>
    </field>
    <field name="ip.src" showname="Source: 10.48.1.195 (10.48.1.195)" size="4" pos="26" show="10.48.1.195" value="0a3001c3"/>
    <field name="ip.addr" showname="Source or Destination Address: 10.48.1.195 (10.48.1.195)" hide="yes" size="4" pos="26" show="10.48.1.195" value="0a3001c3"/>
    <field name="ip.src_host" showname="Source Host: 10.48.1.195" hide="yes" size="4" pos="26" show="10.48.1.195" value="0a3001c3"/>
    <field name="ip.host" showname="Source or Destination Host: 10.48.1.195" hide="yes" size="4" pos="26" show="10.48.1.195" value="0a3001c3"/>
    <field name="ip.dst" showname="Destination: 134.153.48.5 (134.153.48.5)" size="4" pos="30" show="134.153.48.5" value="86993005"/>
    <field name="ip.addr" showname="Source or Destination Address: 134.153.48.5 (134.153.48.5)" hide="yes" size="4" pos="30" show="134.153.48.5" value="86993005"/>
    <field name="ip.dst_host" showname="Destination Host: 134.153.48.5" hide="yes" size="4" pos="30" show="134.153.48.5" value="86993005"/>
    <field name="ip.host" showname="Source or Destination Host: 134.153.48.5" hide="yes" size="4" pos="30" show="134.153.48.5" value="86993005"/>
    <field name="" show="Source GeoIP: Unknown" size="4" pos="26" value="0a3001c3"/>
    <field name="" show="Destination GeoIP: Unknown" size="4" pos="30" value="86993005"/>
  </proto>
  <proto name="tcp" showname="Transmission Control Protocol, Src Port: 51490 (51490), Dst Port: http (80), Seq: 0, Len: 0" size="40" pos="34">
    <field name="tcp.srcport" showname="Source port: 51490 (51490)" size="2" pos="34" show="51490" value="c922"/>
    <field name="tcp.dstport" showname="Destination port: http (80)" size="2" pos="36" show="80" value="0050"/>
    <field name="tcp.port" showname="Source or Destination Port: 51490" hide="yes" size="2" pos="34" show="51490" value="c922"/>
    <field name="tcp.port" showname="Source or Destination Port: 80" hide="yes" size="2" pos="36" show="80" value="0050"/>
    <field name="tcp.stream" showname="Stream index: 6" size="0" pos="34" show="6"/>
    <field name="tcp.len" showname="TCP Segment Len: 0" hide="yes" size="1" pos="46" show="0" value="a0"/>
    <field name="tcp.seq" showname="Sequence number: 0    (relative sequence number)" size="4" pos="38" show="0" value="138008ff"/>
    <field name="tcp.hdr_len" showname="Header length: 40 bytes" size="1" pos="46" show="40" value="a0"/>
    <field name="tcp.flags" showname="Flags: 0x002 (SYN)" size="2" pos="46" show="0x0002" value="2" unmaskedvalue="a002">
      <field name="tcp.flags.res" showname="000. .... .... = Reserved: Not set" size="1" pos="46" show="0" value="0" unmaskedvalue="a0"/>
      <field name="tcp.flags.ns" showname="...0 .... .... = Nonce: Not set" size="1" pos="46" show="0" value="0" unmaskedvalue="a0"/>
      <field name="tcp.flags.cwr" showname=".... 0... .... = Congestion Window Reduced (CWR): Not set" size="1" pos="47" show="0" value="0" unmaskedvalue="02"/>
      <field name="tcp.flags.ecn" showname=".... .0.. .... = ECN-Echo: Not set" size="1" pos="47" show="0" value="0" unmaskedvalue="02"/>
      <field name="tcp.flags.urg" showname=".... ..0. .... = Urgent: Not set" size="1" pos="47" show="0" value="0" unmaskedvalue="02"/>
      <field name="tcp.flags.ack" showname=".... ...0 .... = Acknowledgment: Not set" size="1" pos="47" show="0" value="0" unmaskedvalue="02"/>
      <field name="tcp.flags.push" showname=".... .... 0... = Push: Not set" size="1" pos="47" show="0" value="0" unmaskedvalue="02"/>
      <field name="tcp.flags.reset" showname=".... .... .0.. = Reset: Not set" size="1" pos="47" show="0" value="0" unmaskedvalue="02"/>
      <field name="tcp.flags.syn" showname=".... .... ..1. = Syn: Set" size="1" pos="47" show="1" value="1" unmaskedvalue="02">
        <field name="expert" showname="Expert Info (Chat/Sequence): Connection establish request (SYN): server port http" size="0" pos="47">
          <field name="expert.message" showname="Message: Connection establish request (SYN): server port http" size="0" pos="0" show="Connection establish request (SYN): server port http"/>
          <field name="expert.severity" showname="Severity level: Chat" size="0" pos="0" show="0x00200000"/>
          <field name="expert.group" showname="Group: Sequence" size="0" pos="0" show="0x02000000"/>
        </field>
      </field>
      <field name="tcp.flags.fin" showname=".... .... ...0 = Fin: Not set" size="1" pos="47" show="0" value="0" unmaskedvalue="02"/>
    </field>
    <field name="tcp.window_size_value" showname="Window size value: 29200" size="2" pos="48" show="29200" value="7210"/>
    <field name="tcp.window_size" showname="Calculated window size: 29200" size="2" pos="48" show="29200" value="7210"/>
    <field name="tcp.checksum" showname="Checksum: 0x6cdf [validation disabled]" size="2" pos="50" show="0x6cdf" value="6cdf">
      <field name="tcp.checksum_good" showname="Good Checksum: False" size="2" pos="50" show="0" value="6cdf"/>
      <field name="tcp.checksum_bad" showname="Bad Checksum: False" size="2" pos="50" show="0" value="6cdf"/>
    </field>
    <field name="tcp.options" showname="Options: (20 bytes), Maximum segment size, SACK permitted, Timestamps, No-Operation (NOP), Window scale" size="20" pos="54" show="02:04:05:b4:04:02:08:0a:00:a3:bf:ea:00:00:00:00:01:03:03:07" value="020405b40402080a00a3bfea0000000001030307">
      <field name="tcp.options.mss" showname="Maximum segment size: 1460 bytes" size="4" pos="54" show="" value="">
        <field name="tcp.option_kind" showname="Kind: MSS size (2)" size="1" pos="54" show="2" value="02"/>
        <field name="tcp.option_len" showname="Length: 4" size="1" pos="55" show="4" value="04"/>
        <field name="tcp.options.mss_val" showname="MSS Value: 1460" size="2" pos="56" show="1460" value="05b4"/>
      </field>
      <field name="tcp.options.sack_perm" showname="TCP SACK Permitted Option: True" size="2" pos="58" show="1" value="0402">
        <field name="tcp.option_kind" showname="Kind: SACK Permission (4)" size="1" pos="58" show="4" value="04"/>
        <field name="tcp.option_len" showname="Length: 2" size="1" pos="59" show="2" value="02"/>
      </field>
      <field name="" show="Timestamps: TSval 10731498, TSecr 0" size="10" pos="60" value="080a00a3bfea00000000">
        <field name="tcp.option_kind" showname="Kind: Timestamp (8)" size="1" pos="60" show="8" value="08"/>
        <field name="tcp.option_len" showname="Length: 10" size="1" pos="61" show="10" value="0a"/>
        <field name="tcp.options.timestamp.tsval" showname="Timestamp value: 10731498" size="4" pos="62" show="10731498" value="00a3bfea"/>
        <field name="tcp.options.timestamp.tsecr" showname="Timestamp echo reply: 0" size="4" pos="66" show="0" value="00000000"/>
      </field>
      <field name="" show="No-Operation (NOP)" size="1" pos="70" value="01">
        <field name="tcp.options.type" showname="Type: 1" size="1" pos="70" show="1" value="01">
          <field name="tcp.options.type.copy" showname="0... .... = Copy on fragmentation: No" size="1" pos="70" show="0" value="0" unmaskedvalue="01"/>
          <field name="tcp.options.type.class" showname=".00. .... = Class: Control (0)" size="1" pos="70" show="0" value="0" unmaskedvalue="01"/>
          <field name="tcp.options.type.number" showname="...0 0001 = Number: No-Operation (NOP) (1)" size="1" pos="70" show="1" value="1" unmaskedvalue="01"/>
        </field>
      </field>
      <field name="" show="Window scale: 7 (multiply by 128)" size="3" pos="71" value="030307">
        <field name="tcp.option_kind" showname="Kind: Window Scale (3)" size="1" pos="71" show="3" value="03"/>
        <field name="tcp.option_len" showname="Length: 3" size="1" pos="72" show="3" value="03"/>
        <field name="tcp.options.wscale.shift" showname="Shift count: 7" size="1" pos="73" show="7" value="07"/>
        <field name="tcp.options.wscale.multiplier" showname="Multiplier: 128" size="1" pos="73" show="128" value="07"/>
      </field>
    </field>
  </proto>
</packet>

<packet>
  <proto name="geninfo" pos="0" showname="General information" size="74">
    <field name="num" pos="0" show="190" showname="Number" value="be" size="74"/>
    <field name="len" pos="0" show="74" showname="Frame Length" value="4a" size="74"/>
    <field name="caplen" pos="0" show="74" showname="Captured Length" value="4a" size="74"/>
    <field name="timestamp" pos="0" show="Jan  3, 2014 20:54:55.341494000 NST" showname="Captured Time" value="1388795095.341494000" size="74"/>
  </proto>
  <proto name="frame" showname="Frame 190: 74 bytes on wire (592 bits), 74 bytes captured (592 bits) on interface 0" size="74" pos="0">
    <field name="frame.interface_id" showname="Interface id: 0" size="0" pos="0" show="0"/>
    <field name="frame.encap_type" showname="Encapsulation type: Ethernet (1)" size="0" pos="0" show="1"/>
    <field name="frame.time" showname="Arrival Time: Jan  3, 2014 20:54:55.341494000 NST" size="0" pos="0" show="Jan  3, 2014 20:54:55.341494000"/>
    <field name="frame.offset_shift" showname="Time shift for this packet: 0.000000000 seconds" size="0" pos="0" show="0.000000000"/>
    <field name="frame.time_epoch" showname="Epoch Time: 1388795095.341494000 seconds" size="0" pos="0" show="1388795095.341494000"/>
    <field name="frame.time_delta" showname="Time delta from previous captured frame: 0.005273000 seconds" size="0" pos="0" show="0.005273000"/>
    <field name="frame.time_delta_displayed" showname="Time delta from previous displayed frame: 0.005357000 seconds" size="0" pos="0" show="0.005357000"/>
    <field name="frame.time_relative" showname="Time since reference or first frame: 116.368554000 seconds" size="0" pos="0" show="116.368554000"/>
    <field name="frame.number" showname="Frame Number: 190" size="0" pos="0" show="190"/>
    <field name="frame.len" showname="Frame Length: 74 bytes (592 bits)" size="0" pos="0" show="74"/>
    <field name="frame.cap_len" showname="Capture Length: 74 bytes (592 bits)" size="0" pos="0" show="74"/>
    <field name="frame.marked" showname="Frame is marked: True" size="0" pos="0" show="1"/>
    <field name="frame.ignored" showname="Frame is ignored: False" size="0" pos="0" show="0"/>
    <field name="frame.protocols" showname="Protocols in frame: eth:ip:tcp" size="0" pos="0" show="eth:ip:tcp"/>
    <field name="frame.coloring_rule.name" showname="Coloring Rule Name: HTTP" size="0" pos="0" show="HTTP"/>
    <field name="frame.coloring_rule.string" showname="Coloring Rule String: http || tcp.port == 80" size="0" pos="0" show="http || tcp.port == 80"/>
  </proto>
  <proto name="eth" showname="Ethernet II, Src: AsustekC_f6:97:3e (e0:cb:4e:f6:97:3e), Dst: Pegatron_2f:4d:48 (4c:72:b9:2f:4d:48)" size="14" pos="0">
    <field name="eth.dst" showname="Destination: Pegatron_2f:4d:48 (4c:72:b9:2f:4d:48)" size="6" pos="0" show="4c:72:b9:2f:4d:48" value="4c72b92f4d48">
      <field name="eth.addr" showname="Address: Pegatron_2f:4d:48 (4c:72:b9:2f:4d:48)" size="6" pos="0" show="4c:72:b9:2f:4d:48" value="4c72b92f4d48"/>
      <field name="eth.lg" showname=".... ..0. .... .... .... .... = LG bit: Globally unique address (factory default)" size="3" pos="0" show="0" value="0" unmaskedvalue="4c72b9"/>
      <field name="eth.ig" showname=".... ...0 .... .... .... .... = IG bit: Individual address (unicast)" size="3" pos="0" show="0" value="0" unmaskedvalue="4c72b9"/>
    </field>
    <field name="eth.src" showname="Source: AsustekC_f6:97:3e (e0:cb:4e:f6:97:3e)" size="6" pos="6" show="e0:cb:4e:f6:97:3e" value="e0cb4ef6973e">
      <field name="eth.addr" showname="Address: AsustekC_f6:97:3e (e0:cb:4e:f6:97:3e)" size="6" pos="6" show="e0:cb:4e:f6:97:3e" value="e0cb4ef6973e"/>
      <field name="eth.lg" showname=".... ..0. .... .... .... .... = LG bit: Globally unique address (factory default)" size="3" pos="6" show="0" value="0" unmaskedvalue="e0cb4e"/>
      <field name="eth.ig" showname=".... ...0 .... .... .... .... = IG bit: Individual address (unicast)" size="3" pos="6" show="0" value="0" unmaskedvalue="e0cb4e"/>
    </field>
    <field name="eth.type" showname="Type: IP (0x0800)" size="2" pos="12" show="0x0800" value="0800"/>
  </proto>
  <proto name="ip" showname="Internet Protocol Version 4, Src: 134.153.48.5 (134.153.48.5), Dst: 10.48.1.195 (10.48.1.195)" size="20" pos="14">
    <field name="ip.version" showname="Version: 4" size="1" pos="14" show="4" value="45"/>
    <field name="ip.hdr_len" showname="Header length: 20 bytes" size="1" pos="14" show="20" value="45"/>
    <field name="ip.dsfield" showname="Differentiated Services Field: 0x00 (DSCP 0x00: Default; ECN: 0x00: Not-ECT (Not ECN-Capable Transport))" size="1" pos="15" show="0" value="00">
      <field name="ip.dsfield.dscp" showname="0000 00.. = Differentiated Services Codepoint: Default (0x00)" size="1" pos="15" show="0x00" value="0" unmaskedvalue="00"/>
      <field name="ip.dsfield.ecn" showname=".... ..00 = Explicit Congestion Notification: Not-ECT (Not ECN-Capable Transport) (0x00)" size="1" pos="15" show="0x00" value="0" unmaskedvalue="00"/>
    </field>
    <field name="ip.len" showname="Total Length: 60" size="2" pos="16" show="60" value="003c"/>
    <field name="ip.id" showname="Identification: 0x0000 (0)" size="2" pos="18" show="0x0000" value="0000"/>
    <field name="ip.flags" showname="Flags: 0x02 (Don&apos;t Fragment)" size="1" pos="20" show="0x02" value="40">
      <field name="ip.flags.rb" showname="0... .... = Reserved bit: Not set" size="1" pos="20" show="0" value="40"/>
      <field name="ip.flags.df" showname=".1.. .... = Don&apos;t fragment: Set" size="1" pos="20" show="1" value="40"/>
      <field name="ip.flags.mf" showname="..0. .... = More fragments: Not set" size="1" pos="20" show="0" value="40"/>
    </field>
    <field name="ip.frag_offset" showname="Fragment offset: 0" size="2" pos="20" show="0" value="4000"/>
    <field name="ip.ttl" showname="Time to live: 56" size="1" pos="22" show="56" value="38"/>
    <field name="ip.proto" showname="Protocol: TCP (6)" size="1" pos="23" show="6" value="06"/>
    <field name="ip.checksum" showname="Header checksum: 0x802b [correct]" size="2" pos="24" show="0x802b" value="802b">
      <field name="ip.checksum_good" showname="Good: True" size="2" pos="24" show="1" value="802b"/>
      <field name="ip.checksum_bad" showname="Bad: False" size="2" pos="24" show="0" value="802b"/>
    </field>
    <field name="ip.src" showname="Source: 134.153.48.5 (134.153.48.5)" size="4" pos="26" show="134.153.48.5" value="86993005"/>
    <field name="ip.addr" showname="Source or Destination Address: 134.153.48.5 (134.153.48.5)" hide="yes" size="4" pos="26" show="134.153.48.5" value="86993005"/>
    <field name="ip.src_host" showname="Source Host: 134.153.48.5" hide="yes" size="4" pos="26" show="134.153.48.5" value="86993005"/>
    <field name="ip.host" showname="Source or Destination Host: 134.153.48.5" hide="yes" size="4" pos="26" show="134.153.48.5" value="86993005"/>
    <field name="ip.dst" showname="Destination: 10.48.1.195 (10.48.1.195)" size="4" pos="30" show="10.48.1.195" value="0a3001c3"/>
    <field name="ip.addr" showname="Source or Destination Address: 10.48.1.195 (10.48.1.195)" hide="yes" size="4" pos="30" show="10.48.1.195" value="0a3001c3"/>
    <field name="ip.dst_host" showname="Destination Host: 10.48.1.195" hide="yes" size="4" pos="30" show="10.48.1.195" value="0a3001c3"/>
    <field name="ip.host" showname="Source or Destination Host: 10.48.1.195" hide="yes" size="4" pos="30" show="10.48.1.195" value="0a3001c3"/>
    <field name="" show="Source GeoIP: Unknown" size="4" pos="26" value="86993005"/>
    <field name="" show="Destination GeoIP: Unknown" size="4" pos="30" value="0a3001c3"/>
  </proto>
  <proto name="tcp" showname="Transmission Control Protocol, Src Port: http (80), Dst Port: 51490 (51490), Seq: 0, Ack: 1, Len: 0" size="40" pos="34">
    <field name="tcp.srcport" showname="Source port: http (80)" size="2" pos="34" show="80" value="0050"/>
    <field name="tcp.dstport" showname="Destination port: 51490 (51490)" size="2" pos="36" show="51490" value="c922"/>
    <field name="tcp.port" showname="Source or Destination Port: 80" hide="yes" size="2" pos="34" show="80" value="0050"/>
    <field name="tcp.port" showname="Source or Destination Port: 51490" hide="yes" size="2" pos="36" show="51490" value="c922"/>
    <field name="tcp.stream" showname="Stream index: 6" size="0" pos="34" show="6"/>
    <field name="tcp.len" showname="TCP Segment Len: 0" hide="yes" size="1" pos="46" show="0" value="a0"/>
    <field name="tcp.seq" showname="Sequence number: 0    (relative sequence number)" size="4" pos="38" show="0" value="28afbdab"/>
    <field name="tcp.ack" showname="Acknowledgment number: 1    (relative ack number)" size="4" pos="42" show="1" value="13800900"/>
    <field name="tcp.hdr_len" showname="Header length: 40 bytes" size="1" pos="46" show="40" value="a0"/>
    <field name="tcp.flags" showname="Flags: 0x012 (SYN, ACK)" size="2" pos="46" show="0x0012" value="12" unmaskedvalue="a012">
      <field name="tcp.flags.res" showname="000. .... .... = Reserved: Not set" size="1" pos="46" show="0" value="0" unmaskedvalue="a0"/>
      <field name="tcp.flags.ns" showname="...0 .... .... = Nonce: Not set" size="1" pos="46" show="0" value="0" unmaskedvalue="a0"/>
      <field name="tcp.flags.cwr" showname=".... 0... .... = Congestion Window Reduced (CWR): Not set" size="1" pos="47" show="0" value="0" unmaskedvalue="12"/>
      <field name="tcp.flags.ecn" showname=".... .0.. .... = ECN-Echo: Not set" size="1" pos="47" show="0" value="0" unmaskedvalue="12"/>
      <field name="tcp.flags.urg" showname=".... ..0. .... = Urgent: Not set" size="1" pos="47" show="0" value="0" unmaskedvalue="12"/>
      <field name="tcp.flags.ack" showname=".... ...1 .... = Acknowledgment: Set" size="1" pos="47" show="1" value="1" unmaskedvalue="12"/>
      <field name="tcp.flags.push" showname=".... .... 0... = Push: Not set" size="1" pos="47" show="0" value="0" unmaskedvalue="12"/>
      <field name="tcp.flags.reset" showname=".... .... .0.. = Reset: Not set" size="1" pos="47" show="0" value="0" unmaskedvalue="12"/>
      <field name="tcp.flags.syn" showname=".... .... ..1. = Syn: Set" size="1" pos="47" show="1" value="1" unmaskedvalue="12">
        <field name="expert" showname="Expert Info (Chat/Sequence): Connection establish acknowledge (SYN+ACK): server port http" size="0" pos="47">
          <field name="expert.message" showname="Message: Connection establish acknowledge (SYN+ACK): server port http" size="0" pos="0" show="Connection establish acknowledge (SYN+ACK): server port http"/>
          <field name="expert.severity" showname="Severity level: Chat" size="0" pos="0" show="0x00200000"/>
          <field name="expert.group" showname="Group: Sequence" size="0" pos="0" show="0x02000000"/>
        </field>
      </field>
      <field name="tcp.flags.fin" showname=".... .... ...0 = Fin: Not set" size="1" pos="47" show="0" value="0" unmaskedvalue="12"/>
    </field>
    <field name="tcp.window_size_value" showname="Window size value: 14480" size="2" pos="48" show="14480" value="3890"/>
    <field name="tcp.window_size" showname="Calculated window size: 14480" size="2" pos="48" show="14480" value="3890"/>
    <field name="tcp.checksum" showname="Checksum: 0xff19 [validation disabled]" size="2" pos="50" show="0xff19" value="ff19">
      <field name="tcp.checksum_good" showname="Good Checksum: False" size="2" pos="50" show="0" value="ff19"/>
      <field name="tcp.checksum_bad" showname="Bad Checksum: False" size="2" pos="50" show="0" value="ff19"/>
    </field>
    <field name="tcp.options" showname="Options: (20 bytes), Maximum segment size, SACK permitted, Timestamps, No-Operation (NOP), Window scale" size="20" pos="54" show="02:04:05:64:04:02:08:0a:4b:b7:75:72:00:a3:bf:ea:01:03:03:07" value="020405640402080a4bb7757200a3bfea01030307">
      <field name="tcp.options.mss" showname="Maximum segment size: 1380 bytes" size="4" pos="54" show="" value="">
        <field name="tcp.option_kind" showname="Kind: MSS size (2)" size="1" pos="54" show="2" value="02"/>
        <field name="tcp.option_len" showname="Length: 4" size="1" pos="55" show="4" value="04"/>
        <field name="tcp.options.mss_val" showname="MSS Value: 1380" size="2" pos="56" show="1380" value="0564"/>
      </field>
      <field name="tcp.options.sack_perm" showname="TCP SACK Permitted Option: True" size="2" pos="58" show="1" value="0402">
        <field name="tcp.option_kind" showname="Kind: SACK Permission (4)" size="1" pos="58" show="4" value="04"/>
        <field name="tcp.option_len" showname="Length: 2" size="1" pos="59" show="2" value="02"/>
      </field>
      <field name="" show="Timestamps: TSval 1270314354, TSecr 10731498" size="10" pos="60" value="080a4bb7757200a3bfea">
        <field name="tcp.option_kind" showname="Kind: Timestamp (8)" size="1" pos="60" show="8" value="08"/>
        <field name="tcp.option_len" showname="Length: 10" size="1" pos="61" show="10" value="0a"/>
        <field name="tcp.options.timestamp.tsval" showname="Timestamp value: 1270314354" size="4" pos="62" show="1270314354" value="4bb77572"/>
        <field name="tcp.options.timestamp.tsecr" showname="Timestamp echo reply: 10731498" size="4" pos="66" show="10731498" value="00a3bfea"/>
      </field>
      <field name="" show="No-Operation (NOP)" size="1" pos="70" value="01">
        <field name="tcp.options.type" showname="Type: 1" size="1" pos="70" show="1" value="01">
          <field name="tcp.options.type.copy" showname="0... .... = Copy on fragmentation: No" size="1" pos="70" show="0" value="0" unmaskedvalue="01"/>
          <field name="tcp.options.type.class" showname=".00. .... = Class: Control (0)" size="1" pos="70" show="0" value="0" unmaskedvalue="01"/>
          <field name="tcp.options.type.number" showname="...0 0001 = Number: No-Operation (NOP) (1)" size="1" pos="70" show="1" value="1" unmaskedvalue="01"/>
        </field>
      </field>
      <field name="" show="Window scale: 7 (multiply by 128)" size="3" pos="71" value="030307">
        <field name="tcp.option_kind" showname="Kind: Window Scale (3)" size="1" pos="71" show="3" value="03"/>
        <field name="tcp.option_len" showname="Length: 3" size="1" pos="72" show="3" value="03"/>
        <field name="tcp.options.wscale.shift" showname="Shift count: 7" size="1" pos="73" show="7" value="07"/>
        <field name="tcp.options.wscale.multiplier" showname="Multiplier: 128" size="1" pos="73" show="128" value="07"/>
      </field>
    </field>
    <field name="tcp.analysis" showname="SEQ/ACK analysis" size="0" pos="34" show="" value="">
      <field name="tcp.analysis.acks_frame" showname="This is an ACK to the segment in frame: 188" size="0" pos="34" show="188"/>
      <field name="tcp.analysis.ack_rtt" showname="The RTT to ACK the segment was: 0.005357000 seconds" size="0" pos="34" show="0.005357000"/>
    </field>
  </proto>
</packet>

<packet>
  <proto name="geninfo" pos="0" showname="General information" size="66">
    <field name="num" pos="0" show="191" showname="Number" value="bf" size="66"/>
    <field name="len" pos="0" show="66" showname="Frame Length" value="42" size="66"/>
    <field name="caplen" pos="0" show="66" showname="Captured Length" value="42" size="66"/>
    <field name="timestamp" pos="0" show="Jan  3, 2014 20:54:55.341550000 NST" showname="Captured Time" value="1388795095.341550000" size="66"/>
  </proto>
  <proto name="frame" showname="Frame 191: 66 bytes on wire (528 bits), 66 bytes captured (528 bits) on interface 0" size="66" pos="0">
    <field name="frame.interface_id" showname="Interface id: 0" size="0" pos="0" show="0"/>
    <field name="frame.encap_type" showname="Encapsulation type: Ethernet (1)" size="0" pos="0" show="1"/>
    <field name="frame.time" showname="Arrival Time: Jan  3, 2014 20:54:55.341550000 NST" size="0" pos="0" show="Jan  3, 2014 20:54:55.341550000"/>
    <field name="frame.offset_shift" showname="Time shift for this packet: 0.000000000 seconds" size="0" pos="0" show="0.000000000"/>
    <field name="frame.time_epoch" showname="Epoch Time: 1388795095.341550000 seconds" size="0" pos="0" show="1388795095.341550000"/>
    <field name="frame.time_delta" showname="Time delta from previous captured frame: 0.000056000 seconds" size="0" pos="0" show="0.000056000"/>
    <field name="frame.time_delta_displayed" showname="Time delta from previous displayed frame: 0.000056000 seconds" size="0" pos="0" show="0.000056000"/>
    <field name="frame.time_relative" showname="Time since reference or first frame: 116.368610000 seconds" size="0" pos="0" show="116.368610000"/>
    <field name="frame.number" showname="Frame Number: 191" size="0" pos="0" show="191"/>
    <field name="frame.len" showname="Frame Length: 66 bytes (528 bits)" size="0" pos="0" show="66"/>
    <field name="frame.cap_len" showname="Capture Length: 66 bytes (528 bits)" size="0" pos="0" show="66"/>
    <field name="frame.marked" showname="Frame is marked: True" size="0" pos="0" show="1"/>
    <field name="frame.ignored" showname="Frame is ignored: False" size="0" pos="0" show="0"/>
    <field name="frame.protocols" showname="Protocols in frame: eth:ip:tcp" size="0" pos="0" show="eth:ip:tcp"/>
    <field name="frame.coloring_rule.name" showname="Coloring Rule Name: HTTP" size="0" pos="0" show="HTTP"/>
    <field name="frame.coloring_rule.string" showname="Coloring Rule String: http || tcp.port == 80" size="0" pos="0" show="http || tcp.port == 80"/>
  </proto>
  <proto name="eth" showname="Ethernet II, Src: Pegatron_2f:4d:48 (4c:72:b9:2f:4d:48), Dst: AsustekC_f6:97:3e (e0:cb:4e:f6:97:3e)" size="14" pos="0">
    <field name="eth.dst" showname="Destination: AsustekC_f6:97:3e (e0:cb:4e:f6:97:3e)" size="6" pos="0" show="e0:cb:4e:f6:97:3e" value="e0cb4ef6973e">
      <field name="eth.addr" showname="Address: AsustekC_f6:97:3e (e0:cb:4e:f6:97:3e)" size="6" pos="0" show="e0:cb:4e:f6:97:3e" value="e0cb4ef6973e"/>
      <field name="eth.lg" showname=".... ..0. .... .... .... .... = LG bit: Globally unique address (factory default)" size="3" pos="0" show="0" value="0" unmaskedvalue="e0cb4e"/>
      <field name="eth.ig" showname=".... ...0 .... .... .... .... = IG bit: Individual address (unicast)" size="3" pos="0" show="0" value="0" unmaskedvalue="e0cb4e"/>
    </field>
    <field name="eth.src" showname="Source: Pegatron_2f:4d:48 (4c:72:b9:2f:4d:48)" size="6" pos="6" show="4c:72:b9:2f:4d:48" value="4c72b92f4d48">
      <field name="eth.addr" showname="Address: Pegatron_2f:4d:48 (4c:72:b9:2f:4d:48)" size="6" pos="6" show="4c:72:b9:2f:4d:48" value="4c72b92f4d48"/>
      <field name="eth.lg" showname=".... ..0. .... .... .... .... = LG bit: Globally unique address (factory default)" size="3" pos="6" show="0" value="0" unmaskedvalue="4c72b9"/>
      <field name="eth.ig" showname=".... ...0 .... .... .... .... = IG bit: Individual address (unicast)" size="3" pos="6" show="0" value="0" unmaskedvalue="4c72b9"/>
    </field>
    <field name="eth.type" showname="Type: IP (0x0800)" size="2" pos="12" show="0x0800" value="0800"/>
  </proto>
  <proto name="ip" showname="Internet Protocol Version 4, Src: 10.48.1.195 (10.48.1.195), Dst: 134.153.48.5 (134.153.48.5)" size="20" pos="14">
    <field name="ip.version" showname="Version: 4" size="1" pos="14" show="4" value="45"/>
    <field name="ip.hdr_len" showname="Header length: 20 bytes" size="1" pos="14" show="20" value="45"/>
    <field name="ip.dsfield" showname="Differentiated Services Field: 0x00 (DSCP 0x00: Default; ECN: 0x00: Not-ECT (Not ECN-Capable Transport))" size="1" pos="15" show="0" value="00">
      <field name="ip.dsfield.dscp" showname="0000 00.. = Differentiated Services Codepoint: Default (0x00)" size="1" pos="15" show="0x00" value="0" unmaskedvalue="00"/>
      <field name="ip.dsfield.ecn" showname=".... ..00 = Explicit Congestion Notification: Not-ECT (Not ECN-Capable Transport) (0x00)" size="1" pos="15" show="0x00" value="0" unmaskedvalue="00"/>
    </field>
    <field name="ip.len" showname="Total Length: 52" size="2" pos="16" show="52" value="0034"/>
    <field name="ip.id" showname="Identification: 0xb716 (46870)" size="2" pos="18" show="0xb716" value="b716"/>
    <field name="ip.flags" showname="Flags: 0x02 (Don&apos;t Fragment)" size="1" pos="20" show="0x02" value="40">
      <field name="ip.flags.rb" showname="0... .... = Reserved bit: Not set" size="1" pos="20" show="0" value="40"/>
      <field name="ip.flags.df" showname=".1.. .... = Don&apos;t fragment: Set" size="1" pos="20" show="1" value="40"/>
      <field name="ip.flags.mf" showname="..0. .... = More fragments: Not set" size="1" pos="20" show="0" value="40"/>
    </field>
    <field name="ip.frag_offset" showname="Fragment offset: 0" size="2" pos="20" show="0" value="4000"/>
    <field name="ip.ttl" showname="Time to live: 64" size="1" pos="22" show="64" value="40"/>
    <field name="ip.proto" showname="Protocol: TCP (6)" size="1" pos="23" show="6" value="06"/>
    <field name="ip.checksum" showname="Header checksum: 0xc11c [correct]" size="2" pos="24" show="0xc11c" value="c11c">
      <field name="ip.checksum_good" showname="Good: True" size="2" pos="24" show="1" value="c11c"/>
      <field name="ip.checksum_bad" showname="Bad: False" size="2" pos="24" show="0" value="c11c"/>
    </field>
    <field name="ip.src" showname="Source: 10.48.1.195 (10.48.1.195)" size="4" pos="26" show="10.48.1.195" value="0a3001c3"/>
    <field name="ip.addr" showname="Source or Destination Address: 10.48.1.195 (10.48.1.195)" hide="yes" size="4" pos="26" show="10.48.1.195" value="0a3001c3"/>
    <field name="ip.src_host" showname="Source Host: 10.48.1.195" hide="yes" size="4" pos="26" show="10.48.1.195" value="0a3001c3"/>
    <field name="ip.host" showname="Source or Destination Host: 10.48.1.195" hide="yes" size="4" pos="26" show="10.48.1.195" value="0a3001c3"/>
    <field name="ip.dst" showname="Destination: 134.153.48.5 (134.153.48.5)" size="4" pos="30" show="134.153.48.5" value="86993005"/>
    <field name="ip.addr" showname="Source or Destination Address: 134.153.48.5 (134.153.48.5)" hide="yes" size="4" pos="30" show="134.153.48.5" value="86993005"/>
    <field name="ip.dst_host" showname="Destination Host: 134.153.48.5" hide="yes" size="4" pos="30" show="134.153.48.5" value="86993005"/>
    <field name="ip.host" showname="Source or Destination Host: 134.153.48.5" hide="yes" size="4" pos="30" show="134.153.48.5" value="86993005"/>
    <field name="" show="Source GeoIP: Unknown" size="4" pos="26" value="0a3001c3"/>
    <field name="" show="Destination GeoIP: Unknown" size="4" pos="30" value="86993005"/>
  </proto>
  <proto name="tcp" showname="Transmission Control Protocol, Src Port: 51490 (51490), Dst Port: http (80), Seq: 1, Ack: 1, Len: 0" size="32" pos="34">
    <field name="tcp.srcport" showname="Source port: 51490 (51490)" size="2" pos="34" show="51490" value="c922"/>
    <field name="tcp.dstport" showname="Destination port: http (80)" size="2" pos="36" show="80" value="0050"/>
    <field name="tcp.port" showname="Source or Destination Port: 51490" hide="yes" size="2" pos="34" show="51490" value="c922"/>
    <field name="tcp.port" showname="Source or Destination Port: 80" hide="yes" size="2" pos="36" show="80" value="0050"/>
    <field name="tcp.stream" showname="Stream index: 6" size="0" pos="34" show="6"/>
    <field name="tcp.len" showname="TCP Segment Len: 0" hide="yes" size="1" pos="46" show="0" value="80"/>
    <field name="tcp.seq" showname="Sequence number: 1    (relative sequence number)" size="4" pos="38" show="1" value="13800900"/>
    <field name="tcp.ack" showname="Acknowledgment number: 1    (relative ack number)" size="4" pos="42" show="1" value="28afbdac"/>
    <field name="tcp.hdr_len" showname="Header length: 32 bytes" size="1" pos="46" show="32" value="80"/>
    <field name="tcp.flags" showname="Flags: 0x010 (ACK)" size="2" pos="46" show="0x0010" value="10" unmaskedvalue="8010">
      <field name="tcp.flags.res" showname="000. .... .... = Reserved: Not set" size="1" pos="46" show="0" value="0" unmaskedvalue="80"/>
      <field name="tcp.flags.ns" showname="...0 .... .... = Nonce: Not set" size="1" pos="46" show="0" value="0" unmaskedvalue="80"/>
      <field name="tcp.flags.cwr" showname=".... 0... .... = Congestion Window Reduced (CWR): Not set" size="1" pos="47" show="0" value="0" unmaskedvalue="10"/>
      <field name="tcp.flags.ecn" showname=".... .0.. .... = ECN-Echo: Not set" size="1" pos="47" show="0" value="0" unmaskedvalue="10"/>
      <field name="tcp.flags.urg" showname=".... ..0. .... = Urgent: Not set" size="1" pos="47" show="0" value="0" unmaskedvalue="10"/>
      <field name="tcp.flags.ack" showname=".... ...1 .... = Acknowledgment: Set" size="1" pos="47" show="1" value="1" unmaskedvalue="10"/>
      <field name="tcp.flags.push" showname=".... .... 0... = Push: Not set" size="1" pos="47" show="0" value="0" unmaskedvalue="10"/>
      <field name="tcp.flags.reset" showname=".... .... .0.. = Reset: Not set" size="1" pos="47" show="0" value="0" unmaskedvalue="10"/>
